{
  "registry_id": "kidults-milestone-registry",
  "registry_name": "Milestone Registry",
  "registry_version": "1.0.0",
  "schema_version": "1.0.0",
  "owner": "KPMO",
  "custodian": "Atlas",
  "status": "ACTIVE",
  "effective_at": "2026-08-12T12:00:00+09:00",
  "record_directory": "records",
  "record_count": 1,
  "current_record_id": "milestone-ms-0001-first-canonical-snapshot",
  "records": [
    {"id":"milestone-ms-0001-first-canonical-snapshot","path":"records/milestone-ms-0001-first-canonical-snapshot.json","version":"1.0.0","status":"IN_PROGRESS"}
  ]
}
